{
  "mova_version": "3.3",
  "id": "route_webhook",
  "description": "Generated from VNL",
  "policies": {
    "timeout_ms": 15000
  },
  "actions": [
    {
      "type": "emit_event",
      "channel": "webhook",
      "payload": {
        "route": "billing"
      },
      "idempotency_key": "inv-42"
    }
  ]
}