{
  "mova_version": "3.3",
  "id": "from_vnl_post_3_3",
  "description": "Generated from VNL",
  "policies": {
    "timeout_ms": 15000
  },
  "actions": [
    {
      "type": "http_fetch",
      "endpoint": "https://httpbin.org/post",
      "method": "POST",
      "payload": "{\"ping\":1}",
      "save_as": "resp"
    },
    {
      "type": "print",
      "message": "status={{resp.status}}"
    }
  ]
}