{
  "mova_version": "3.3",
  "id": "sync_invoice",
  "description": "Generated from VNL",
  "policies": {
    "timeout_ms": 15000
  },
  "actions": [
    {
      "type": "emit_event",
      "channel": "sync",
      "payload": {
        "entity": "invoice",
        "id": "inv_42",
        "for": "cust_1",
        "at": "2025-09-06T10:00:00Z"
      }
    }
  ]
}